{
  "schema_version": "2.0.0",
  "id": "AIS-0001",
  "name": "探索",
  "node_type": "search",
  "status": "active",
  "data_version": "0.1.0-draft",
  "evaluator": "search.exists",
  "ports": {
    "inputs": [{"id": "in", "kind": "flow", "data_type": "flow"}],
    "outputs": [
      {"id": "found", "kind": "flow", "data_type": "flow"},
      {"id": "not_found", "kind": "flow", "data_type": "flow"}
    ]
  },
  "parameter_schema": {"type": "object", "properties": {}, "required": [], "additionalProperties": false}
}
